<?xml version="1.0" encoding="UTF-8" ?>
<gems xmlns:xsi="http://www.w3.org/2001/XMLSchema-instance"
      xmlns="http://www.example.com/gems"
      xsi:schemaLocation="http://www.example.com/gems gems.xsd">
    <SemipreciousGem id ="1">
        <name>Beryl</name>
        <preciousness>semiprecious</preciousness>
        <origin>Bolivia</origin>
        <visualParameters>
            <color>yellow</color>
            <transparency>3.0</transparency>
            <facetNum>4</facetNum>
        </visualParameters>
        <value>0.8</value>
    </SemipreciousGem>
    <SemipreciousGem id ="2">
        <name>Ametrine</name>
        <preciousness>semiprecious</preciousness>
        <origin>Colombia</origin>
        <visualParameters>
            <color>blue</color>
            <transparency>2.67</transparency>
            <facetNum>6</facetNum>
        </visualParameters>
        <value>2.0</value>
    </SemipreciousGem>
    <PreciousGem id ="3">
        <name>Emerald</name>
        <preciousness>precious</preciousness>
        <origin>Colombia</origin>
        <visualParameters>
            <color>green</color>
            <transparency>25.5</transparency>
            <facetNum>8</facetNum>
        </visualParameters>
        <value>2.5</value>
    </PreciousGem>
    <SemipreciousGem id ="4">
        <name>Sapphire</name>
        <preciousness>semiprecious</preciousness>
        <origin>India</origin>
        <visualParameters>
            <color>blue</color>
            <transparency>42.6</transparency>
            <facetNum>11</facetNum>
        </visualParameters>
        <value>3.0</value>
    </SemipreciousGem>
    <SemipreciousGem id ="5">
        <name>Andalusite</name>
        <preciousness>semiprecious</preciousness>
        <origin>South Africa</origin>
        <visualParameters>
            <color>yellow</color>
            <transparency>3.85</transparency>
            <facetNum>14</facetNum>
        </visualParameters>
        <value>3.8</value>
    </SemipreciousGem>
    <PreciousGem id ="6">
        <name>Diaspore</name>
        <preciousness>precious</preciousness>
        <origin>Turkey</origin>
        <visualParameters>
            <color>yellow</color>
            <transparency>6.8</transparency>
            <facetNum>15</facetNum>
        </visualParameters>
        <value>1.6</value>
    </PreciousGem>
    <SemipreciousGem id ="7">
        <name>Benitoite</name>
        <preciousness>semiprecious</preciousness>
        <origin>USA</origin>
        <visualParameters>
            <color>blue</color>
            <transparency>46.8</transparency>
            <facetNum>4</facetNum>
        </visualParameters>
        <value>0.8</value>
    </SemipreciousGem>
    <SemipreciousGem id ="8">
        <name>Chrysoberyl</name>
        <preciousness>semiprecious</preciousness>
        <origin>Russia</origin>
        <visualParameters>
            <color>blue</color>
            <transparency>6.85</transparency>
            <facetNum>6</facetNum>
        </visualParameters>
        <value>2.3</value>
    </SemipreciousGem>
    <PreciousGem id ="9">
        <name>Apatite</name>
        <preciousness>precious</preciousness>
        <origin>Russia</origin>
        <visualParameters>
            <color>green</color>
            <transparency>63.52</transparency>
            <facetNum>9</facetNum>
        </visualParameters>
        <value>3.6</value>
    </PreciousGem>
    <SemipreciousGem id ="10">
        <name>Beryl</name>
        <preciousness>semiprecious</preciousness>
        <origin>Colombia</origin>
        <visualParameters>
            <color>blue</color>
            <transparency>2.67</transparency>
            <facetNum>10</facetNum>
        </visualParameters>
        <value>1.6</value>
    </SemipreciousGem>
    <SemipreciousGem id ="11">
        <name>Rhinestone</name>
        <preciousness>semiprecious</preciousness>
        <origin>Colombia</origin>
        <visualParameters>
            <color>white</color>
            <transparency>1.35</transparency>
            <facetNum>11</facetNum>
        </visualParameters>
        <value>2.4</value>
    </SemipreciousGem>
    <SemipreciousGem id ="12">
        <name>Jeremejevite</name>
        <preciousness>semiprecious</preciousness>
        <origin>Russia</origin>
        <visualParameters>
            <color>blue</color>
            <transparency>3.85</transparency>
            <facetNum>13</facetNum>
        </visualParameters>
        <value>1.8</value>
    </SemipreciousGem>
    <SemipreciousGem id ="13">
        <name>Garnet</name>
        <preciousness>semiprecious</preciousness>
        <origin>Russia</origin>
        <visualParameters>
            <color>red</color>
            <transparency>43.5</transparency>
            <facetNum>8</facetNum>
        </visualParameters>
        <value>1.4</value>
    </SemipreciousGem>
    <PreciousGem id ="14">
        <name>Chrysoberyl</name>
        <preciousness>precious</preciousness>
        <origin>Sri Lanka</origin>
        <visualParameters>
            <color>green</color>
            <transparency>1.4</transparency>
            <facetNum>11</facetNum>
        </visualParameters>
        <value>2.3</value>
    </PreciousGem>
    <PreciousGem id ="15">
        <name>Diamond</name>
        <preciousness>precious</preciousness>
        <origin>Brazil</origin>
        <visualParameters>
            <color>blue</color>
            <transparency>85.2</transparency>
            <facetNum>14</facetNum>
        </visualParameters>
        <value>3.8</value>
    </PreciousGem>
    <SemipreciousGem id ="16">
        <name>Amethyst</name>
        <preciousness>semiprecious</preciousness>
        <origin>Germany</origin>
        <visualParameters>
            <color>purple</color>
            <transparency>7</transparency>
            <facetNum>13</facetNum>
        </visualParameters>
        <value>1.5</value>
    </SemipreciousGem>

</gems>